{
  "lastUpdated": "2026-03-06T05:07:05.800Z",
  "lastScanStartedAt": "2026-03-06T05:07:04.431Z",
  "lastScanCompletedAt": "2026-03-06T05:07:05.800Z",
  "sources": [
    {
      "name": "local-test-skills",
      "path": "/shared/projects/validator-skills/test-skills",
      "lastSyncedAt": "2026-03-06T05:07:05.795Z",
      "localPath": "/shared/projects/validator-skills/test-skills"
    }
  ],
  "skills": [
    {
      "name": "arithmetic-skill",
      "displayName": "arithmetic-skill",
      "sourceRepo": "/shared/projects/validator-skills/test-skills",
      "sourceName": "local-test-skills",
      "path": "/shared/projects/validator-skills/test-skills/arithmetic-skill",
      "version": "1.0.0",
      "versionFrom": "manifest",
      "firstSeenAt": "2026-03-05T19:20:33.324Z",
      "lastCheckedAt": "2026-03-06T05:07:05.801Z",
      "lastStatus": "PASSED",
      "consecutiveFailures": 0,
      "totalChecks": 2
    },
    {
      "name": "code-review-skill",
      "displayName": "code-review-skill",
      "sourceRepo": "/shared/projects/validator-skills/test-skills",
      "sourceName": "local-test-skills",
      "path": "/shared/projects/validator-skills/test-skills/code-review-skill",
      "version": "1.0.0",
      "versionFrom": "manifest",
      "firstSeenAt": "2026-03-05T19:20:33.324Z",
      "lastCheckedAt": "2026-03-06T05:07:05.801Z",
      "lastStatus": "PASSED",
      "consecutiveFailures": 0,
      "totalChecks": 2
    },
    {
      "name": "http-checker-skill",
      "displayName": "http-checker-skill",
      "sourceRepo": "/shared/projects/validator-skills/test-skills",
      "sourceName": "local-test-skills",
      "path": "/shared/projects/validator-skills/test-skills/http-checker-skill",
      "version": "1.0.0",
      "versionFrom": "manifest",
      "firstSeenAt": "2026-03-05T19:20:33.324Z",
      "lastCheckedAt": "2026-03-06T05:07:05.801Z",
      "lastStatus": "PASSED",
      "consecutiveFailures": 0,
      "totalChecks": 2
    },
    {
      "name": "json-validator-skill",
      "displayName": "json-validator-skill",
      "sourceRepo": "/shared/projects/validator-skills/test-skills",
      "sourceName": "local-test-skills",
      "path": "/shared/projects/validator-skills/test-skills/json-validator-skill",
      "version": "1.0.0",
      "versionFrom": "manifest",
      "firstSeenAt": "2026-03-05T19:20:33.324Z",
      "lastCheckedAt": "2026-03-06T05:07:05.801Z",
      "lastStatus": "PASSED",
      "consecutiveFailures": 0,
      "totalChecks": 2
    },
    {
      "name": "real-skill-fail",
      "displayName": "real-skill-fail",
      "sourceRepo": "/shared/projects/validator-skills/test-skills",
      "sourceName": "local-test-skills",
      "path": "/shared/projects/validator-skills/test-skills/real-skill-fail",
      "version": "v1.0.0",
      "versionFrom": "manifest",
      "firstSeenAt": "2026-03-05T19:20:33.324Z",
      "lastCheckedAt": "2026-03-06T05:07:05.801Z",
      "lastStatus": "FAILED",
      "consecutiveFailures": 0,
      "totalChecks": 2
    },
    {
      "name": "real-skill-math",
      "displayName": "real-skill-math",
      "sourceRepo": "/shared/projects/validator-skills/test-skills",
      "sourceName": "local-test-skills",
      "path": "/shared/projects/validator-skills/test-skills/real-skill-math",
      "version": "v1.0.0",
      "versionFrom": "manifest",
      "firstSeenAt": "2026-03-05T19:20:33.324Z",
      "lastCheckedAt": "2026-03-06T05:07:05.801Z",
      "lastStatus": "PASSED",
      "consecutiveFailures": 0,
      "totalChecks": 2
    },
    {
      "name": "real-skill-string",
      "displayName": "real-skill-string",
      "sourceRepo": "/shared/projects/validator-skills/test-skills",
      "sourceName": "local-test-skills",
      "path": "/shared/projects/validator-skills/test-skills/real-skill-string",
      "version": "v1.0.0",
      "versionFrom": "manifest",
      "firstSeenAt": "2026-03-05T19:20:33.324Z",
      "lastCheckedAt": "2026-03-06T05:07:05.801Z",
      "lastStatus": "PASSED",
      "consecutiveFailures": 0,
      "totalChecks": 2
    },
    {
      "name": "sample-skill",
      "displayName": "sample-skill",
      "sourceRepo": "/shared/projects/validator-skills/test-skills",
      "sourceName": "local-test-skills",
      "path": "/shared/projects/validator-skills/test-skills/sample-skill",
      "version": "v1.0.0",
      "versionFrom": "manifest",
      "firstSeenAt": "2026-03-05T19:20:33.324Z",
      "lastCheckedAt": "2026-03-06T05:07:05.801Z",
      "lastStatus": "PASSED",
      "consecutiveFailures": 0,
      "totalChecks": 2
    },
    {
      "name": "skill-a",
      "displayName": "skill-a",
      "sourceRepo": "/shared/projects/validator-skills/test-skills",
      "sourceName": "local-test-skills",
      "path": "/shared/projects/validator-skills/test-skills/skill-a",
      "version": "v1.0.0",
      "versionFrom": "manifest",
      "firstSeenAt": "2026-03-05T19:20:33.324Z",
      "lastCheckedAt": "2026-03-06T05:07:05.801Z",
      "lastStatus": "PASSED",
      "consecutiveFailures": 0,
      "totalChecks": 2
    },
    {
      "name": "skill-b",
      "displayName": "skill-b",
      "sourceRepo": "/shared/projects/validator-skills/test-skills",
      "sourceName": "local-test-skills",
      "path": "/shared/projects/validator-skills/test-skills/skill-b",
      "version": "v1.0.0",
      "versionFrom": "manifest",
      "firstSeenAt": "2026-03-05T19:20:33.324Z",
      "lastCheckedAt": "2026-03-06T05:07:05.801Z",
      "lastStatus": "PASSED",
      "consecutiveFailures": 0,
      "totalChecks": 2
    },
    {
      "name": "weather-skill",
      "displayName": "weather-skill",
      "sourceRepo": "/shared/projects/validator-skills/test-skills",
      "sourceName": "local-test-skills",
      "path": "/shared/projects/validator-skills/test-skills/weather-skill",
      "version": "v1.0.0",
      "versionFrom": "manifest",
      "firstSeenAt": "2026-03-05T19:20:33.324Z",
      "lastCheckedAt": "2026-03-06T05:07:05.801Z",
      "lastStatus": "FAILED",
      "consecutiveFailures": 0,
      "totalChecks": 2
    }
  ]
}